{
  "schema": "https://nscaledev.github.io/chapar/schemas/vlad-image-site-contract/v1",
  "schema_version": 1,
  "status": "example",
  "roles": {
    "builders": [
      "1111111111111111111111111111111111111111111111111111111111111111"
    ],
    "publishers": [
      "2222222222222222222222222222222222222222222222222222222222222222"
    ],
    "validators": [
      "3333333333333333333333333333333333333333333333333333333333333333"
    ]
  },
  "targets": {
    "linux-x86_64-generic": {
      "hardware_class": "physical-x86-64-v1",
      "partition": "REPLACE_WITH_X86_V1_PARTITION",
      "constraint": "REPLACE_WITH_X86_V1_CONSTRAINT"
    },
    "linux-x86_64-v4": {
      "hardware_class": "physical-x86-64-v4",
      "partition": "REPLACE_WITH_X86_V4_PARTITION",
      "constraint": "REPLACE_WITH_X86_V4_CONSTRAINT"
    },
    "linux-aarch64-generic": {
      "hardware_class": "physical-aarch64",
      "partition": "REPLACE_WITH_AARCH64_PARTITION",
      "constraint": "REPLACE_WITH_AARCH64_CONSTRAINT"
    },
    "linux-aarch64-gb300": {
      "hardware_class": "gb300",
      "partition": "REPLACE_WITH_GB300_PARTITION",
      "constraint": "REPLACE_WITH_GB300_CONSTRAINT"
    }
  }
}
